{
  "mova_version": "4.0.0",
  "envelope_type": "env.mova_ai_bootstrap_generate_v1",
  "envelope_id": "mova_bootstrap_chatgpt_main_v1",
  "requested_by": "sergii",
  "target": {
    "mova_version": "4.0.0",
    "target_id": "chatgpt_main",
    "model_family": "openai:gpt-5.1-thinking",
    "channel": "chat",
    "role": "architect-assistant",
    "host_product": "ChatGPT",
    "notes": "Primary chat-based MOVA architect assistant."
  },
  "options": {
    "language": "en",
    "include_examples": true
  }
}
