{
  "mova_version": "4.0.0",
  "envelope_type": "env.mova_ai_bootstrap_generate_v1",
  "envelope_id": "mova_bootstrap_codex_vscode_main_v1",
  "requested_by": "sergii",
  "target": {
    "mova_version": "4.0.0",
    "target_id": "codex_vscode_main",
    "model_family": "codex:vs-code-agent",
    "channel": "ide_agent",
    "role": "mova-architect-executor",
    "host_product": "VS Code / MOVA Workbench",
    "notes": "Primary Codex-like agent in VS Code used for MOVA development."
  },
  "options": {
    "language": "en",
    "include_examples": true
  }
}
